2026-01-16 20:03:47 | INFO | P01 | =================
2026-01-16 20:03:47 | INFO | P01 | === RUN START ===
2026-01-16 20:03:47 | INFO | P01 | project=Foundations of Professional Python
2026-01-16 20:03:47 | INFO | P01 | repo_dir=third-time-charm
2026-01-16 20:03:47 | INFO | P01 | python=3.14.2
2026-01-16 20:03:48 | INFO | P01 | os=Windows 10
2026-01-16 20:03:48 | INFO | P01 | shell=powershell
2026-01-16 20:03:48 | INFO | P01 | cwd=.
2026-01-16 20:03:48 | INFO | P01 | github_actions=False
2026-01-16 20:03:48 | INFO | P01 | =================
2026-01-16 20:03:48 | INFO | P01 | START main()..................
2026-01-16 20:03:48 | INFO | P01 | Generated formatted multi-line SUMMARY string.
2026-01-16 20:03:48 | INFO | P01 | Returning the str to the calling function.
2026-01-16 20:03:48 | INFO | P01 | 
    Custom Information:
        Company name: DataFun Analytics
        Employee count: 150
        TODO: Add your other global variables below:





    
2026-01-16 20:03:48 | INFO | P01 | Generated formatted multi-line SUMMARY string.
2026-01-16 20:03:48 | INFO | P01 | Returning the str to the calling function.
2026-01-16 20:03:48 | INFO | P01 | 
    Descriptive Statistics for Snowfall (inches):
        Total snowfall: 22.50 inches
        TODO: Add your count of measurements below:

        TODO: Add your minimum and maximum snowfall below:

        Average snowfall: 4.50 inches
        TODO: Add your standard deviation below:

    
2026-01-16 20:03:48 | INFO | P01 | END main()..................
2026-01-16 20:35:46 | INFO | P01 | Generated formatted multi-line SUMMARY string.
2026-01-16 20:35:46 | INFO | P01 | Returning the str to the calling function.
2026-01-16 20:43:16 | INFO | P01 | Generated formatted multi-line SUMMARY string.
2026-01-16 20:43:16 | INFO | P01 | Returning the str to the calling function.
2026-01-16 20:45:04 | INFO | P01 | Generated formatted multi-line SUMMARY string.
2026-01-16 20:45:04 | INFO | P01 | Returning the str to the calling function.
2026-01-16 20:48:16 | INFO | P01 | =================
2026-01-16 20:48:16 | INFO | P01 | === RUN START ===
2026-01-16 20:48:16 | INFO | P01 | project=Foundations of Professional Python
2026-01-16 20:48:16 | INFO | P01 | repo_dir=third-time-charm
2026-01-16 20:48:16 | INFO | P01 | python=3.14.2
2026-01-16 20:48:16 | INFO | P01 | os=Windows 10
2026-01-16 20:48:16 | INFO | P01 | shell=powershell
2026-01-16 20:48:16 | INFO | P01 | cwd=.
2026-01-16 20:48:16 | INFO | P01 | github_actions=False
2026-01-16 20:48:16 | INFO | P01 | =================
2026-01-16 20:48:17 | INFO | P01 | START main()..................
2026-01-16 20:48:17 | INFO | P01 | Generated formatted multi-line SUMMARY string.
2026-01-16 20:48:17 | INFO | P01 | Returning the str to the calling function.
2026-01-16 20:48:17 | INFO | P01 | 
    Custom Information:
        Company name: DataFun Analytics
        Employee count: 150
        TODO: Add your other global variables below:





    
2026-01-16 20:48:17 | INFO | P01 | Generated formatted multi-line SUMMARY string.
2026-01-16 20:48:17 | INFO | P01 | Returning the str to the calling function.
2026-01-16 20:48:17 | INFO | P01 | 
    Descriptive Statistics for Snowfall (inches):
        Total snowfall: 22.50 inches
        TODO: Add your count of measurements below:

        TODO: Add your minimum and maximum snowfall below:

        Average snowfall: 4.50 inches
        TODO: Add your standard deviation below:

    
2026-01-16 20:48:17 | INFO | P01 | END main()..................
2026-01-17 15:24:57 | INFO | P01 | Generated formatted multi-line SUMMARY string.
2026-01-17 15:24:57 | INFO | P01 | Returning the str to the calling function.
2026-01-17 21:01:44 | INFO | P01 | =================
2026-01-17 21:01:44 | INFO | P01 | === RUN START ===
2026-01-17 21:01:44 | INFO | P01 | project=Foundations of Professional Python
2026-01-17 21:01:44 | INFO | P01 | repo_dir=third-time-charm
2026-01-17 21:01:44 | INFO | P01 | python=3.14.2
2026-01-17 21:01:45 | INFO | P01 | os=Windows 10
2026-01-17 21:01:45 | INFO | P01 | shell=powershell
2026-01-17 21:01:45 | INFO | P01 | cwd=.
2026-01-17 21:01:45 | INFO | P01 | github_actions=False
2026-01-17 21:01:45 | INFO | P01 | =================
2026-01-17 21:01:45 | INFO | P01 | START main()..................
2026-01-17 21:01:45 | INFO | P01 | Generated formatted multi-line SUMMARY string.
2026-01-17 21:01:45 | INFO | P01 | Returning the str to the calling function.
2026-01-17 21:01:45 | INFO | P01 | 
    Custom Information:
        Company name: Ducks Inc
        Employee count: 150
        Company motto: Quack like you mean it
        Ducks in migration: 75
        Hours to migration destination: 48.5
        Is migration season: True
        Ducks feedback post migration: ['Great migration experience!', 'The weather was perfect.', "I'm excited to be back in the office.Looking forward to the next migration."]


    
2026-01-17 21:01:45 | INFO | P01 | Generated formatted multi-line SUMMARY string.
2026-01-17 21:01:45 | INFO | P01 | Returning the str to the calling function.
2026-01-17 21:01:45 | INFO | P01 | 
    Descriptive Statistics for Snowfall (inches):
        Total snowfall: 20.50 inches
        Count of measurements: 5
        Minimum snowfall: 0.50 inches
        Maximum snowfall: 6.50 inches

        Average snowfall: 4.10 inches
        Standard deviation: 2.30 inches

    
2026-01-17 21:01:45 | INFO | P01 | END main()..................
